{
  "toolVersion": "x.y.z",
  "issues": [
    {
      "code": "QFAI-TRACE-022",
      "severity": "error",
      "category": "compatibility",
      "message": "契約が Spec から参照されていません: DB-0001",
      "file": ".qfai/specs",
      "rule": "traceability.contractCoverage",
      "refs": ["DB-0001"]
    }
  ],
  "counts": { "info": 0, "warning": 0, "error": 1 },
  "traceability": {
    "sc": {
      "total": 1,
      "covered": 1,
      "missing": 0,
      "missingIds": [],
      "refs": {
        "SC-0001": ["packages/qfai/tests/core/traceability.test.ts"]
      }
    },
    "testFiles": {
      "globs": [
        "packages/qfai/tests/**/*.test.ts",
        "packages/qfai/tests/**/*.spec.ts",
        "src/**/*.test.ts",
        "src/**/*.spec.ts"
      ],
      "excludeGlobs": [
        "**/node_modules/**",
        "**/.git/**",
        "**/.qfai/**",
        "**/dist/**",
        "**/build/**",
        "**/coverage/**",
        "**/.next/**",
        "**/out/**"
      ],
      "matchedFileCount": 1,
      "truncated": false,
      "limit": 20000
    }
  }
}
